REGION,PROVINCE,CITY,LOCATION,OWNERSHIP_CLASS,Unnamed: 6,NAME OF HOSPITAL,ABC,MEDICAL_DIRECTOR,CLASS,SERVCE CAPABILI TY,CONTACT,EMAIL,FAX,MOBILE,REMARKS,Actual Hospital Name,Mapping_Address,lat,lng
CENTRAL LUZON,NUEVA ECIJA,,"San Fernando Sur, Cabiao",PVT,CABIAO GENERAL HOSPITAL,28,Dr. Napoleon S. Palor,General,Level 1,(044) 486-6337,onemed@yahoo.c om,NaN,NaN,NaN,NaN,CABIAO GENERAL HOSPITAL,"CABIAO GENERAL HOSPITAL, CENTRAL LUZON, NUEVA ECIJA",15.260541,120.86483
CENTRAL LUZON,NUEVA ECIJA,,"Bagain St. Sta. Veronica Subd.,Guimba",PVT,"GUIMBA GENERAL HOSPITAL,INC.",17,Dr. Felix Diosdado R. Lumang,General,Level 1,(044) 958-1643,r_lumang@yahoo. com,NaN,NaN,NaN,NaN,"GUIMBA GENERAL HOSPITAL,INC.","GUIMBA GENERAL HOSPITAL,INC., CENTRAL LUZON, NUEVA ECIJA",15.6617623,120.7635133
CENTRAL LUZON,NUEVA ECIJA,,"J. P. Rizal Street, Purok 7, Jose Abad Santos Ave., Alua, San Isidro",PVT,NUEVA ECIJA MEDICS HOSPITAL,29,Dr. May Dolores M. Magno,General,Level 1,0932 843 2374,nemedicshospital @yahoo.com,NaN,NaN,NaN,NaN,NUEVA ECIJA MEDICS HOSPITAL,"NUEVA ECIJA MEDICS HOSPITAL, CENTRAL LUZON, NUEVA ECIJA",15.3076728,120.8980255
CENTRAL LUZON,NUEVA ECIJA,,"# 180  National Highway Castellano, San Leonardo",PVT,DR. GLORIA D. LACSON GENERAL HOSPITAL,50,Dr. Massomeh VC Shamsoddin-Padiernos,General,Level 1,(044) 486- 2432/486-2918/,dgdlgh@yahoo.co m,NaN,9175787788,NaN,NaN,DR. GLORIA D. LACSON GENERAL HOSPITAL,"DR. GLORIA D. LACSON GENERAL HOSPITAL, CENTRAL LUZON, NUEVA ECIJA",15.3177184,120.9370957
CENTRAL LUZON,NUEVA ECIJA,,"Maharlika Hi-way, San Antonio, San Leonardo Nueva Ecija",PVT,"NUEVA ECIJA MEDICAL CENTER, INC.",100,Dr. Marlon Jay D. Gonzales,General,Level 2,0933 -583 1972,ne_medicalcenter @yahoo.com,NaN,NaN,NaN,NaN,"NUEVA ECIJA MEDICAL CENTER, INC.","NUEVA ECIJA MEDICAL CENTER, INC., CENTRAL LUZON, NUEVA ECIJA",15.3517634,120.9392652
CENTRAL LUZON,NUEVA ECIJA,City,"Sarile, Cabanatuan City",PVT,PREMIERE MEDICAL CENTER,190,Dr. Sylvia B Yang,General,Level 3,7848,ter@yahoo.com,4635868,NaN,NaN,NaN,PREMIERE MEDICAL CENTER,"PREMIERE MEDICAL CENTER, CENTRAL LUZON, NUEVA ECIJA, City",15.5070088,120.9671236
CENTRAL LUZON,NUEVA ECIJA,City,Cabanatuan City,PVT,"HOSPITAL, INC.",133,Santarina,General,Level 3,/9605541,@gmail.com,9406890,NaN,NaN,NaN,"HOSPITAL, INC.","HOSPITAL, INC., CENTRAL LUZON, NUEVA ECIJA, City",15.5782871,121.1113286
CENTRAL LUZON,NUEVA ECIJA,City,Cabanatuan City,PVT,PHILIPPINES,100,Dr. Edwin N. Argonza,General,Level 2,044-4634735,oo.com.PH,4636628,NaN,NaN,NaN,PHILIPPINES,"PHILIPPINES, CENTRAL LUZON, NUEVA ECIJA, City",15.5782871,121.1113286
CENTRAL LUZON,NUEVA ECIJA,City,"Sangitan, Cabanatuan City",PVT,"HEALTH SYSTEM, INC.",100,Dr. Alejandro R. Garcia,General,Level 2,1585,mail.com,4643969,NaN,NaN,NaN,"HEALTH SYSTEM, INC.","HEALTH SYSTEM, INC., CENTRAL LUZON, NUEVA ECIJA, City",15.5782871,121.1113286
CENTRAL LUZON,NUEVA ECIJA,Cabanatuan City,"City, Nueva Ecija",PVT,"MEDICAL CENTER OF CENTRAL LUZON, INC.",98,Dr. Ronnie P. Torres,General,Level 2,044-9400300,ptionmc@yahoo.c om,9404262,NaN,NaN,NaN,"MEDICAL CENTER OF CENTRAL LUZON, INC.","MEDICAL CENTER OF CENTRAL LUZON, INC., CENTRAL LUZON, NUEVA ECIJA, Cabanatuan City",15.4865047,120.973393
CENTRAL LUZON,NUEVA ECIJA,Gapan City,"Gapan City, Nueva Ecija",PVT,"HEALTH SYSTEM, INC. (EXT.)",67,Engr. Oscar C. Deus,General,Level 2,(044) 486-2363,g@gmail.com,62365,NaN,NaN,NaN,"HEALTH SYSTEM, INC. (EXT.)","HEALTH SYSTEM, INC. (EXT.), CENTRAL LUZON, NUEVA ECIJA, Gapan City",15.2912094,121.0105733
CENTRAL LUZON,NUEVA ECIJA,San Jose City,"Brgy. R. Rueda, San Jose City",PVT,HEART OF JESUS HOSPITAL,65,Dr. Relito S. Ignacio,General,Level 1,044 958 9108,heartofjesushospi tal@yahoo.com,NaN,NaN,61-65,NaN,HEART OF JESUS HOSPITAL,"HEART OF JESUS HOSPITAL, CENTRAL LUZON, NUEVA ECIJA, San Jose City",15.7955518,120.9909096
CENTRAL LUZON,TARLAC,,Bamban,PVT,DIVINE MERCY HOSPITAL,18,Dr. Alvin C. Bondoc,General,Level 1,NaN,m.ph,NaN,9219303131,NaN,NaN,DIVINE MERCY HOSPITAL,"DIVINE MERCY HOSPITAL, CENTRAL LUZON, TARLAC",15.2873622,120.569776
CENTRAL LUZON,TARLAC,,"F. Timbol St. San Nicolas, Concepcion",PVT,DR. EUTIQUIO LL. ATANACIO JR. MEMORIAL HOSPITAL,17,Dr. Danilo M. Atanacio,General,Level 1,(045) 923-0240,deamhi@yahoo.c om.ph,NaN,NaN,NaN,NaN,DR. EUTIQUIO LL. ATANACIO JR. MEMORIAL HOSPITAL,"DR. EUTIQUIO LL. ATANACIO JR. MEMORIAL HOSPITAL, CENTRAL LUZON, TARLAC",15.3236644,120.6552289
CENTRAL LUZON,TARLAC,,"Sta. Rita,Concepcion",PVT,M. NAPEÑAS MULTISPECIALTY HOSPITAL,24,Dr. Marites T. Napeñas,General,Level 1,(045) 923-0819,dm_nap@yahoo.c om,NaN,NaN,NaN,NaN,M. NAPEÑAS MULTISPECIALTY HOSPITAL,"M. NAPEÑAS MULTISPECIALTY HOSPITAL, CENTRAL LUZON, TARLAC",15.3201307,120.6575552
CENTRAL LUZON,TARLAC,,"Green Village, Concepcion",PVT,IMMACULATE CONCEPCION POLYCLINIC  & HOSPITAL INC.,29,"Dr. Elpidio G. Inez, Jr.",General,Level 1,(045) 923-0537,immaculate_cpn2 000@yahoo.com,NaN,NaN,NaN,NaN,IMMACULATE CONCEPCION POLYCLINIC  & HOSPITAL INC.,"IMMACULATE CONCEPCION POLYCLINIC  & HOSPITAL INC., CENTRAL LUZON, TARLAC",15.3265672,120.64893
CENTRAL LUZON,TARLAC,,"Abagon, Gerona",PVT,GERONA HOSP. OF THE SACRED HEART,20,Dr. Renato E. Ang,General,Level 1,(045) 931-0977,"ghsh_vpa@yahoo
.com",NaN,NaN,NaN,NaN,GERONA HOSP. OF THE SACRED HEART,"GERONA HOSP. OF THE SACRED HEART, CENTRAL LUZON, TARLAC",15.6084476,120.6053583
CENTRAL LUZON,TARLAC,,Paniqui,PVT,JOWELL GENERAL HOSPITAL,20,Dr. Jolab O. Daguro,General,Level 1,0409/931-0050,oo.com,NaN,NaN,NaN,NaN,JOWELL GENERAL HOSPITAL,"JOWELL GENERAL HOSPITAL, CENTRAL LUZON, TARLAC",15.6627509,120.5757032
CENTRAL LUZON,TARLAC,,"Norte , Paniqui",PVT,"RAYOS-VALENTIN HOSPITAL, INC.",45,Dr. Fidel C. Monson,General,Level 1,(045) 931-0621,pital@yahoo.com,831,NaN,NaN,NaN,"RAYOS-VALENTIN HOSPITAL, INC.","RAYOS-VALENTIN HOSPITAL, INC., CENTRAL LUZON, TARLAC",15.6721506,120.5822877
CENTRAL LUZON,TARLAC,,Camiling,PVT,SALVADOR GENERAL HOSPITAL,20,"Salvador, Jr.",General,Level 1,(045) 934-0312,m,NaN,NaN,NaN,NaN,SALVADOR GENERAL HOSPITAL,"SALVADOR GENERAL HOSPITAL, CENTRAL LUZON, TARLAC",15.6903382,120.4057832
CENTRAL LUZON,TARLAC,,"P. Burgos Street, Poblacion B., Camiling, Tarlac",PVT,"SEÑOR STO. NIÑO HOSPITAL, INC.",75,Dr. Edith S. Bermudez,General,Level 2,(045) 9340176,ssnh_agnes@yah oo.com,9340806,NaN,NaN,NaN,"SEÑOR STO. NIÑO HOSPITAL, INC.","SEÑOR STO. NIÑO HOSPITAL, INC., CENTRAL LUZON, TARLAC",15.6895679,120.4145641
CENTRAL LUZON,TARLAC,,"MacArthur Highway, Brgy. Sto. Domingo 2nd , Capas, Tarlac",PVT,CAPAS MEDICAL CENTER,50,Dr. Maria Teresita P. Gueco,General,Level 2,"045-
6150430/0995373
7326/0916439289
4/9255937","capasmedicalcent er2017@gmail.co m/mtpg09@icloud
.com",NaN,NaN,NaN,NaN,CAPAS MEDICAL CENTER,"CAPAS MEDICAL CENTER, CENTRAL LUZON, TARLAC",15.3508072,120.5929406
CENTRAL LUZON,TARLAC,Tarlac CIty,"Block 6, F. Tanedo St., San Nicolas, Tarlac City, Tarlac",PVT,LOVING MOTHER GENERAL HOSPITAL AND DIAGNOSTIC CENTER INC.,100,Dr. Angeles  E. Torio-De Leon,General,Level 2,"045-4708502-
03/3090256/0917
8358976",lovingmotherhosp ital@gmail.com,NaN,NaN,NaN,NaN,LOVING MOTHER GENERAL HOSPITAL AND DIAGNOSTIC CENTER INC.,"LOVING MOTHER GENERAL HOSPITAL AND DIAGNOSTIC CENTER INC., CENTRAL LUZON, TARLAC, Tarlac CIty",15.4928178,120.5933487
CENTRAL LUZON,TARLAC,Tarlac City,"F. Tañedo Street, Poblacion, Tarlac City",PVT,TALON GENERAL HOSPITAL,50,Dr. Raymond Nolaco F. Talon,General,Level 2,"045-
9820239/9821400
/9825415",talongenhospital @yahoo.com,"045-
9821400/98
23889",NaN,NaN,NaN,TALON GENERAL HOSPITAL,"TALON GENERAL HOSPITAL, CENTRAL LUZON, TARLAC, Tarlac City",15.4909631,120.5917065
CENTRAL LUZON,TARLAC,Tarlac City,"P. Hilario Street, Ligtasan, Tarlac City",PVT,RAMOS GENERAL HOSPITAL,90,"Dr. Roman L. Belmonte, Jr.",General,Level 2,045-9820542,"rgh_tarlac@yahoo
.com",9827074,NaN,NaN,NaN,RAMOS GENERAL HOSPITAL,"RAMOS GENERAL HOSPITAL, CENTRAL LUZON, TARLAC, Tarlac City",15.484983,120.5931144
CENTRAL LUZON,TARLAC,Tarlac City,"McArthur Highway, Barangay San Nicolas, Tarlac City",PVT,JECSONS MEDICAL CENTER,180,"Dr. Jose Y. Chua, Jr.",General,Level 2,045-9825501,"jecsons03@yahoo
.com",9823510,NaN,NaN,NaN,JECSONS MEDICAL CENTER,"JECSONS MEDICAL CENTER, CENTRAL LUZON, TARLAC, Tarlac City",15.4911461,120.5973927
CENTRAL LUZON,TARLAC,Tarlac City,"Hospital Drive, San Vicente, Tarlac City",PVT,"CENTRAL LUZON DOCTORS’ HOSPITAL, INC.",196,Dr. Ferdinand Francis Ma.,General,Level 3,045 9252534,mail@cldh.com.p h,9824430,NaN,NaN,NaN,"CENTRAL LUZON DOCTORS’ HOSPITAL, INC.","CENTRAL LUZON DOCTORS’ HOSPITAL, INC., CENTRAL LUZON, TARLAC, Tarlac City",15.4781792,120.5869477
CENTRAL LUZON,TARLAC,Tarlac City,"8th St. TDMC Hospital Drive, Fairlane Subdivision, San Vicente Tarlac City",PVT,TARLAC MEDICAL CENTER,100,Dr. Consolacion Vega- Aquino,General,Level 2,045 - 6066493,NaN,NaN,NaN,NaN,NaN,TARLAC MEDICAL CENTER,"TARLAC MEDICAL CENTER, CENTRAL LUZON, TARLAC, Tarlac City",15.4713286,120.590358
CENTRAL LUZON,ZAMBALES,,"#616 Ntl Rd. Palanginan Iba, Zambales",PVT,STA. CECILIA MEDICAL CENTER,27,Dr. Adonis M. Calaycay,General,Level 1,(047) 811-3317,scmc_08@yahoo. com,NaN,NaN,NaN,NaN,STA. CECILIA MEDICAL CENTER,"STA. CECILIA MEDICAL CENTER, CENTRAL LUZON, ZAMBALES",15.3207159,119.9873909
CENTRAL LUZON,ZAMBALES,,"#14 Brill St., West Bajac, Bajac,",PVT,ZMMG COOP WOMEN'S AND CHILDREN'S HOSPITAL,24,Arnildo C. Tamayo,General,Level 1,(047) 602-0278,zmmgcoop@yaho o.com/zmmg.hrd @gmail.com,NaN,NaN,NaN,NaN,ZMMG COOP WOMEN'S AND CHILDREN'S HOSPITAL,"ZMMG COOP WOMEN'S AND CHILDREN'S HOSPITAL, CENTRAL LUZON, ZAMBALES",14.8390902,120.2827283
CENTRAL LUZON,ZAMBALES,Olongapo City,"# 2 National Hi-way, Brgy. Baretto, Olongapo City",PVT,"OUR LADY OF LOURDES INTERNATIONAL MEDICAL CENTER, INC.",99,Dr. Noel J. Lacsamana,General,Level 2,"047-2229011-
13/Eloisa rosaparao- 09178128836",mail@ollimc.com. ph,"2229012-13
loc160",NaN,NaN,NaN,"OUR LADY OF LOURDES INTERNATIONAL MEDICAL CENTER, INC.","OUR LADY OF LOURDES INTERNATIONAL MEDICAL CENTER, INC., CENTRAL LUZON, ZAMBALES, Olongapo City",14.827537,120.2847653
CENTRAL LUZON,ZAMBALES,Olongapo City,"# 62-18th St. Corner  Harris
, St. E.B.B. O.C.",PVT,RIDON'S ST JUDE MEDICAL CENTER,39,Dr. Maricel Ridon Cristobal,General,Level 1,047 222 5833,ridonst.judemedic alcenter@yahoo.c om,NaN,NaN,NaN,NaN,RIDON'S ST JUDE MEDICAL CENTER,"RIDON'S ST JUDE MEDICAL CENTER, CENTRAL LUZON, ZAMBALES, Olongapo City",14.836203,120.286596
CENTRAL LUZON,ZAMBALES,,"Block 8 Lot 1A & 1B Dewey Avenue, Central Business District Area, Subic Bay Freefort Zone, Zambales",PVT,"ALLIED CARE EXPERTS MEDICAL CENTER-BAYPOINTE, INC.",87,Dr. Wilfredo Santos,General,Level 2,"047-
2506070/0930805
2100",boardsec@unihea lthbaypointe.com/ acemcblabratory @gmail.com,2500534,NaN,NaN,NaN,"ALLIED CARE EXPERTS MEDICAL CENTER-BAYPOINTE, INC.","ALLIED CARE EXPERTS MEDICAL CENTER-BAYPOINTE, INC., CENTRAL LUZON, ZAMBALES",14.8238888,120.2721641
CENTRAL LUZON,ZAMBALES,Olongapo City,"# 75 Kessing Street,New Asinan, O.C.",PVT,MOTHER AND CHILD GENERAL HOSPITAL,18,Dr. Dale D. Dominado,General,Level 1,(047) 222- 3012/222-3356,dale_dominado@ yahoo.com,NaN,NaN,NaN,NaN,MOTHER AND CHILD GENERAL HOSPITAL,"MOTHER AND CHILD GENERAL HOSPITAL, CENTRAL LUZON, ZAMBALES, Olongapo City",14.8302781,120.2877403
CALABARZON,BATANGAS,,"National Highway, Banaybanay 2nd, San Jose, Batangas",PVT,METRO SAN JOSE MEDICAL CENTER,50,Dr. Marjorie R. Felix,General,Level 2,043-7260207,msjmc2012@yaho o.com,7025490,9156990323,NaN,NaN,METRO SAN JOSE MEDICAL CENTER,"METRO SAN JOSE MEDICAL CENTER, CALABARZON, BATANGAS",13.9216987,121.1055884
CALABARZON,BATANGAS,,"R. Diokno St., Lemery, Batangas",PVT,LEMERY DOCTORS MEDICAL CENTER,27,"Dr. Rodolfo V. Aguila, Jr.",General,Level 2,"043-
4111531/4090918",lemerydoctors@y ahoo.com,NaN,NaN,NaN,NaN,LEMERY DOCTORS MEDICAL CENTER,"LEMERY DOCTORS MEDICAL CENTER, CALABARZON, BATANGAS",13.8770024,120.9153671
CALABARZON,BATANGAS,,"Palanas, Lemery, Batangas",PVT,METRO LEMERY MEDICAL CENTER,72,"Dr. Cesar N. Reyes, Jr. (new Medical Director Dr. Mitos Noble-Bello) per COC of x-ray",General,Level 2,043-4090480,customerservice @mlmc.com.ph,"5194878/74
00245",NaN,NaN,NaN,METRO LEMERY MEDICAL CENTER,"METRO LEMERY MEDICAL CENTER, CALABARZON, BATANGAS",13.8875306,120.9115179
CALABARZON,BATANGAS,,"V. Illustre Ave., Lemery, Batangas",PVT,"OUR LADY OF CAYSASAY MEDICAL CENTER, INC.",60,"Dr. Ernesto Vincent Flores II (new Medical Director Dr. Ernesto C. Tenorio, Jr.) effective 5/1/2021",General,Level 2,"043-4091888-
92/4110980-83",NaN,4090088,NaN,dec. 100-60 (2/5/2021),NaN,"OUR LADY OF CAYSASAY MEDICAL CENTER, INC.","OUR LADY OF CAYSASAY MEDICAL CENTER, INC., CALABARZON, BATANGAS",13.7566786,121.0615167
CALABARZON,BATANGAS,,"Diversion Road, Carsuche, Taal, Batangas",PVT,TAAL POLYMEDIC HOSPITAL AND MEDICAL CENTER,40,Dr. Basil Eric J. Tenorio,General,Level 2,043-2142384,tphmedcen96@ya hoo.com,NaN,NaN,NaN,NaN,TAAL POLYMEDIC HOSPITAL AND MEDICAL CENTER,"TAAL POLYMEDIC HOSPITAL AND MEDICAL CENTER, CALABARZON, BATANGAS",13.88594,120.9418996
CALABARZON,BATANGAS,,"National Hi-way, Brgy. Caloocan, Balayan, Batangas",PVT,METRO BALAYAN MEDICAL CENTER,58,Dr. Lily B. Macalalad,General,Level 2,043-7401350,"metrobalayanmed icalcenter@yahoo
.com",NaN,NaN,NaN,NaN,METRO BALAYAN MEDICAL CENTER,"METRO BALAYAN MEDICAL CENTER, CALABARZON, BATANGAS",13.9497928,120.7279309
CALABARZON,BATANGAS,,"Brgy. Langgagan, Balayan, Batangas",PVT,BALAYAN BAYVIEW HOSPITAL AND MEDICAL CENTER,45,Dr. Rosalinda Manalo,General,Level 1,(043) 211-6734,balayanbayviewh ospital@yahoo.co m,NaN,NaN,NaN,NaN,BALAYAN BAYVIEW HOSPITAL AND MEDICAL CENTER,"BALAYAN BAYVIEW HOSPITAL AND MEDICAL CENTER, CALABARZON, BATANGAS",13.9457114,120.7537632
CALABARZON,BATANGAS,,"Brgy,.Lanatan, Balayan,Batangas",PVT,MEDICAL CENTER WESTERN BATANGAS,40,Dr. Henrietta A. Mortel,General,Level 2,043-4071103,medicalcenterwes ternbatangas@ya hoo.com,NaN,NaN,NaN,NaN,MEDICAL CENTER WESTERN BATANGAS,"MEDICAL CENTER WESTERN BATANGAS, CALABARZON, BATANGAS",13.953836,120.728349
CALABARZON,BATANGAS,,"F. Mangobos St., cor. Taño Road, Poblacion I, Bauan, Batangas",PVT,BAUAN DOCTORS GENERAL HOSPITAL,100,Dr. Reuel M. Dimalibot,General,Level 2,043-7274019,bauandoctors@g mail.com,NaN,NaN,NaN,NaN,BAUAN DOCTORS GENERAL HOSPITAL,"BAUAN DOCTORS GENERAL HOSPITAL, CALABARZON, BATANGAS",13.7953526,121.0014171
CALABARZON,BATANGAS,,"Gualberto St. Brgy. A. Poblacion, Rosario, Batangas",PVT,"CHRIST THE SAVIOUR GENERAL HOSPITAL, INC.",28,Liberty M. Bagting,General,Level 1,(043) 740-1412,csghi@yahoo.co m,NaN,NaN,NaN,NaN,"CHRIST THE SAVIOUR GENERAL HOSPITAL, INC.","CHRIST THE SAVIOUR GENERAL HOSPITAL, INC., CALABARZON, BATANGAS",13.8460273,121.2093474
CALABARZON,BATANGAS,,"#87 Gualberto Avenue, Poblacion, Rosario, Batangas",PVT,UNTALAN GENERAL HOSPITAL,12,Dr. Eddie P. Untalan,General,Level 1,(043) 740-9514,untalangen_hospi tal@yahoo.com,NaN,NaN,NaN,NaN,UNTALAN GENERAL HOSPITAL,"UNTALAN GENERAL HOSPITAL, CALABARZON, BATANGAS",13.8452645,121.2063357
CALABARZON,BATANGAS,,"Brgy. Masaya, Rosario, Batangas",PVT,ST. GERARD GENERAL HOSPITAL,30,Dr. Cesar Limbo,General,Level 1,NaN,NaN,NaN,9206363344,NaN,NaN,ST. GERARD GENERAL HOSPITAL,"ST. GERARD GENERAL HOSPITAL, CALABARZON, BATANGAS",13.8356281,121.1812871
CALABARZON,BATANGAS,,"130 V Escano cor G. Recto St. Rosario, Batangas",PVT,STO. ROSARIO HOSPITAL,24,Dr. Gil E. Maderazo,General,Level 1,(043) 321-3988,sntrosario@yaho o.com,NaN,NaN,50-24,NaN,STO. ROSARIO HOSPITAL,"STO. ROSARIO HOSPITAL, CALABARZON, BATANGAS",13.8457948,121.2042359
CALABARZON,BATANGAS,,"J. Magtibay St., Rosario, Batangas",PVT,PALMA-MALALUAN HOSPITAL,25,Dr. Darwin Jay M. Inciong,General,Level 1,"(043)778-4811 to
15",palma.malaluan@ yahoo.com,NaN,NaN,NaN,NaN,PALMA-MALALUAN HOSPITAL,"PALMA-MALALUAN HOSPITAL, CALABARZON, BATANGAS",13.8442524,121.2047802
CALABARZON,BATANGAS,,"Brgy 11, Poblacion, Nasugbu, Batangas",PVT,JABEZ MEDICAL CENTER,25,Dr. Oliver B. Ferrer,General,Level 1,(043) 416-0446,jabezmedicalcent er@yahoo.com,NaN,NaN,NaN,NaN,JABEZ MEDICAL CENTER,"JABEZ MEDICAL CENTER, CALABARZON, BATANGAS",14.065021,120.633461
CALABARZON,BATANGAS,,"Barangay Bagong Tubig, Calaca, Batangas",PVT,OSPITAL NG CALACA,25,Dr. Ricardo A. Batac,General,Level 1,(043) 223-7708/,onc.mchc@gmail. com,NaN,9176528068,NaN,NaN,OSPITAL NG CALACA,"OSPITAL NG CALACA, CALABARZON, BATANGAS",13.9370401,120.8001333
CALABARZON,BATANGAS,,"J. Pastor St., Poblacion, Ibaan, Batangas",PVT,"QUEEN MARY HOSPITAL, INC.",15,Dioscoro M. Angelia Jr.,General,Level 1,(043) 311-2028,queenmaryhosp@ yahoo.com.ph,NaN,NaN,NaN,NaN,"QUEEN MARY HOSPITAL, INC.","QUEEN MARY HOSPITAL, INC., CALABARZON, BATANGAS",13.8214873,121.1337077
CALABARZON,BATANGAS,,"Poblacion, Padre Garcia, Batangas",PVT,"DR. R. ROSALES MEMORIAL MEDICAL HOSPITAL, INC.",16,Dr. John Gerard A. Villa,General,Level 1,(043) 515-9190,rosales.villahospit al@gmail.com,NaN,NaN,NaN,NaN,"DR. R. ROSALES MEMORIAL MEDICAL HOSPITAL, INC.","DR. R. ROSALES MEMORIAL MEDICAL HOSPITAL, INC., CALABARZON, BATANGAS",13.8761382,121.2114247
CALABARZON,BATANGAS,,"Tumanay, Talisay, Batangas",PVT,ST. ANDREW HOSPITAL,25,Mark Anthony Mendoza,General,Level 1,(043) 773-0196,standrewhospital1 982@gmail.com,NaN,NaN,NaN,NaN,ST. ANDREW HOSPITAL,"ST. ANDREW HOSPITAL, CALABARZON, BATANGAS",14.0933658,121.0259568
CALABARZON,BATANGAS,,"Pulo, Calit Calit, San Juan, Batangas",PVT,"SAN JUAN DOCTORS HOSPITAL, INC.",28,Dra. Glecie DG Alidio,General,Level 1,(043) 575-3138,sanjuandoctorsho spital@ymail.com,NaN,NaN,NaN,NaN,"SAN JUAN DOCTORS HOSPITAL, INC.","SAN JUAN DOCTORS HOSPITAL, INC., CALABARZON, BATANGAS",13.8269903,121.4103485
CALABARZON,BATANGAS,,"Sico, 2.0, San Juan, Batangas",PVT,DIVINE CARE HOSP. MULTI SERVICES CORPORATION,21,"Dr.Susan Malaluan Singh,  MHA",General,Level 1,(043) 575-3408,divinecarehospita l@ymail.com,NaN,NaN,NaN,NaN,DIVINE CARE HOSP. MULTI SERVICES CORPORATION,"DIVINE CARE HOSP. MULTI SERVICES CORPORATION, CALABARZON, BATANGAS",13.880407,121.034641
CALABARZON,BATANGAS,,"Poblacion, San Pascual, Batangas",PVT,SAINT PASCAL DE BAYLON HOSPITAL CORPORATION,25,"Dr. Mylene M. Monteclaro, MHCA",General,Level 1,"(043) 425-5062/
728-0045",spdh@yahoo.com,NaN,NaN,NaN,NaN,SAINT PASCAL DE BAYLON HOSPITAL CORPORATION,"SAINT PASCAL DE BAYLON HOSPITAL CORPORATION, CALABARZON, BATANGAS",13.7884501,121.0219733
CALABARZON,BATANGAS,,"1181 Pres. J.P. Laurel Highway, San Roque, Sto. Tomas, Batangas",PVT,SANTO TOMAS GENERAL HOSPITAL,18,Johnny F. Platon,General,Level 1,(043) 729-5060,stgh91@yahoo.co m,NaN,NaN,NaN,NaN,SANTO TOMAS GENERAL HOSPITAL,"SANTO TOMAS GENERAL HOSPITAL, CALABARZON, BATANGAS",14.09826,121.147259
CALABARZON,BATANGAS,,A. Mabini Street Poblacion 2 Sto. Tomas Batangas,PVT,SAINT VINCENT DE PAUL HOSPITAL,15,Dr. Allan C. Lanip,General,Level 1,(043) 778-1060,allanc.lanip@gmai l.com,NaN,NaN,NaN,NaN,SAINT VINCENT DE PAUL HOSPITAL,"SAINT VINCENT DE PAUL HOSPITAL, CALABARZON, BATANGAS",14.1074484,121.1427335
CALABARZON,BATANGAS,,"Brgy. San Antonio, San Pascual, Batangas",PVT,SAN ANTONIO LIFE CARE CORPORATION  (new),35,Dr. Arnold D. Dimaculangan,General,Level 2,"043-7261723/
0917-154283",NaN,NaN,NaN,new,NaN,SAN ANTONIO LIFE CARE CORPORATION  (new),"SAN ANTONIO LIFE CARE CORPORATION  (new), CALABARZON, BATANGAS",13.7890589,121.0178451
CALABARZON,BATANGAS,,"Maharlika Highway, Poblacion 2, Sto. Tomas, Batangas",PVT,"ST. FRANCES CABRINI MEDICAL CENTER, INCORPORATED
(formerly ST. FRANCES CABRINI MEDICAL CENTER, INC.)",100,Dr. Malen M. Gellido,General,Level 2,043-7784811-15,cabrini.medicalce nter@gmail.com,NaN,NaN,changed INC. to INCORPORATED,NaN,"ST. FRANCES CABRINI MEDICAL CENTER, INCORPORATED
(formerly ST. FRANCES CABRINI MEDICAL CENTER, INC.)","ST. FRANCES CABRINI MEDICAL CENTER, INCORPORATED
(formerly ST. FRANCES CABRINI MEDICAL CENTER, INC.), CALABARZON, BATANGAS",14.1089715,121.1456052
CALABARZON,BATANGAS,Batangas City,"Lopez Jaena St., Batangas City, Batangas",PVT,SAINT PATRICK'S HOSPITAL MEDICAL CENTER,100,"Dr. Abegayle Machelle
M. Perez-Chua",General,Level 3,043-7230754,sphmc_hr@ymail. com,NaN,NaN,NaN,NaN,SAINT PATRICK'S HOSPITAL MEDICAL CENTER,"SAINT PATRICK'S HOSPITAL MEDICAL CENTER, CALABARZON, BATANGAS, Batangas City",13.7555318,121.060235
CALABARZON,BATANGAS,Batangas City,"17 P. Prieto St., Brgy. 4, Poblacion, Batangas City",PVT,"GOLDEN GATE BATANGAS HOSPITAL, INC.",100,Dr. Romulo L. Rosales,General,Level 2,043-7233011,gggh_HR@yahoo. com,NaN,NaN,NaN,NaN,"GOLDEN GATE BATANGAS HOSPITAL, INC.","GOLDEN GATE BATANGAS HOSPITAL, INC., CALABARZON, BATANGAS, Batangas City",13.7576692,121.0617348
CALABARZON,BATANGAS,Batangas City,"Diversion Road, Barangay Alangilan, Batangas City, Batangas",PVT,BATANGAS HEALTHCARE SPECIALISTS MEDICAL CENTER,78,"Dr. Anacleta P. Valdez, Fpsp, Mha,Phd",General,Level 2,"043-7412345 /
8000 / 0808 /
1888",NaN,NaN,NaN,NaN,NaN,BATANGAS HEALTHCARE SPECIALISTS MEDICAL CENTER,"BATANGAS HEALTHCARE SPECIALISTS MEDICAL CENTER, CALABARZON, BATANGAS, Batangas City",13.7876482,121.0602264
CALABARZON,BATANGAS,Batangas City,"Diversion Road, Barangay Bolbok, Batangas City, Batangas",PVT,UNITED DOCTORS OF ST. CAMILLUS DE LELLIS HOSPITAL,80,Dr. Ariel T. Atienza,General,Level 2,043-7403087-88,stcamillus_fn23@ yahoo.com/stcami llus_fn23@gmail.c om,7403086,NaN,NaN,NaN,UNITED DOCTORS OF ST. CAMILLUS DE LELLIS HOSPITAL,"UNITED DOCTORS OF ST. CAMILLUS DE LELLIS HOSPITAL, CALABARZON, BATANGAS, Batangas City",13.7819306,121.0559394
CALABARZON,BATANGAS,Batangas City,"Brgy. Gulod, Itaas, Batangas City, Batangas",PVT,"BATANGAS HEALTH CARE HOSPITAL, JESUS OF NAZARETH",139,Dr. Libio A. Macatangay,General,Level 2,"043-
7232918/7220550",bhchjon_nazareth @yahoo.com,"7238615/72
20550",NaN,NaN,NaN,"BATANGAS HEALTH CARE HOSPITAL, JESUS OF NAZARETH","BATANGAS HEALTH CARE HOSPITAL, JESUS OF NAZARETH, CALABARZON, BATANGAS, Batangas City",13.7594463,121.0769641
CALABARZON,BATANGAS,Lipa City,"706 Sinagtala, Brgy 7. Lipa City, Batangas",PVT,DIVINE LOVE GENERAL HOSPITAL,25,Dr. Carlo Jose Fuentebella,General,Level 1,784-1338,dlgh83@yahoo.co m,NaN,NaN,NaN,NaN,DIVINE LOVE GENERAL HOSPITAL,"DIVINE LOVE GENERAL HOSPITAL, CALABARZON, BATANGAS, Lipa City",13.9367989,121.1585516
CALABARZON,BATANGAS,Lipa City,"#2 C.M. Recto Avenue, Lipa City, Batangas",PVT,"SAN ANTONIO MEDICAL CENTER OF LIPA, INC.",25,Dr. Emma R. Caringal,General,Level 2,043-7562522,sanantonio_gen19 70@yahoo.com,NaN,NaN,NaN,NaN,"SAN ANTONIO MEDICAL CENTER OF LIPA, INC.","SAN ANTONIO MEDICAL CENTER OF LIPA, INC., CALABARZON, BATANGAS, Lipa City",13.9422381,121.1651103
CALABARZON,BATANGAS,Lipa City,"J.P. Laurel Highway, Mataas na Lupa, Lipa City, Batangas",PVT,"MARY MEDIATRIX MEDICAL CENTER, INC.",120,"Dr. Asis Encarnacion, Jr.",General,Level 3,043-7736800,mmmcadm@mm mc.ph/admin@m mmc.ph,"7736861/77
36860",NaN,dec 200 to 120,NaN,"MARY MEDIATRIX MEDICAL CENTER, INC.","MARY MEDIATRIX MEDICAL CENTER, INC., CALABARZON, BATANGAS, Lipa City",13.9439574,121.1522633
CALABARZON,BATANGAS,Lipa City,"F. Manalo St., Lipa City, Batangas",PVT,N.L. VILLA MEMORIAL MEDICAL CENTER,60,Dr. Rita Mae Villa de Luna,General,Level 2,043-7564871-72,villahospital.com,NaN,NaN,"dec 99-40
(5/17/2021) inc. 40-
60 (9/30/2021)",NaN,N.L. VILLA MEMORIAL MEDICAL CENTER,"N.L. VILLA MEMORIAL MEDICAL CENTER, CALABARZON, BATANGAS, Lipa City",13.9387674,121.1654241
CALABARZON,BATANGAS,Lipa City,"Ayala Highway, Balintawak, Lipa City, Batangas",PVT,LIPA MEDIX MEDICAL CENTER,95,Dr. Nestor L. Atienza,General,Level 2,043-7563008,lmmc.inc@yahoo. com,NaN,NaN,dec. 150 to 95 (2/9/2021),NaN,LIPA MEDIX MEDICAL CENTER,"LIPA MEDIX MEDICAL CENTER, CALABARZON, BATANGAS, Lipa City",13.9476661,121.1569668
CALABARZON,BATANGAS,Lipa City,"J.P. Laurel Highway, Brgy. Marawoy, Lipa City, Batangas",PVT,METRO LIPA MEDICAL CENTER,48,"Dr. John Rodolfo Suan, Jr.",General,Level 2,043-7560549,metrolipamedicalc enter@yahoo.com,7028198,NaN,NaN,NaN,METRO LIPA MEDICAL CENTER,"METRO LIPA MEDICAL CENTER, CALABARZON, BATANGAS, Lipa City",13.9684328,121.166647
CALABARZON,BATANGAS,Tanauan City,"#50 Sixto Castillo St., Tanauan City, Batangas",PVT,GONZALES MEDICAL AND CHILDRENS HOSPITAL,38,Dr. Francis Raymund Gonzales,General,Level 1,(043) 778-1218,gonzaleshospital @yahoo.com.ph,NaN,NaN,NaN,NaN,GONZALES MEDICAL AND CHILDRENS HOSPITAL,"GONZALES MEDICAL AND CHILDRENS HOSPITAL, CALABARZON, BATANGAS, Tanauan City",14.0839798,121.1512074
CALABARZON,BATANGAS,Tanauan City,"Collantes St. Brgy. 7. Tanuan City, Batangas",PVT,H.M. CORACHEA GENERAL HOSPITAL,27,Diogenes L. Corachea,General,Level 1,(043) 778-1298,hm_corachea@ya hoo.com,NaN,NaN,NaN,NaN,H.M. CORACHEA GENERAL HOSPITAL,"H.M. CORACHEA GENERAL HOSPITAL, CALABARZON, BATANGAS, Tanauan City",14.0820964,121.1458319
CALABARZON,BATANGAS,Tanauan City,"A. Mabini Avenue, Tanauan City, Batangas",PVT,C.P. REYES HOSPITAL,50,Dr. Carlito P. Reyes,General,Level 2,043-7845401-06,"recruitment_cprh @yahoo.com/tqm @cpreyeshospital
.com",7781620,NaN,NaN,NaN,C.P. REYES HOSPITAL,"C.P. REYES HOSPITAL, CALABARZON, BATANGAS, Tanauan City",14.0844253,121.1495092
CALABARZON,BATANGAS,Tanauan City,"No. 1 Pres. Laurel Highway, Tanauan City, Batangas",PVT,DANIEL O. MERCADO MEDICAL CENTER,127,Dr. Anna Panganiban- Andal,General,Level 2,043-7781810,adminservices@d mmcinc.com,7780960,NaN,NaN,NaN,DANIEL O. MERCADO MEDICAL CENTER,"DANIEL O. MERCADO MEDICAL CENTER, CALABARZON, BATANGAS, Tanauan City",14.0801109,121.1507907
CALABARZON,CAVITE,,"Santosan Street, Brgy. Manggahan, General Trias, Cavite",PVT,"GENTRI MEDICAL CENTER AND HOSPITAL, INC.",50,Dr. Divina P. Rojas,General,Level 2,046-4240888,gentrimedical_30 @yahoo.com,"4240888
loc207",NaN,NaN,NaN,"GENTRI MEDICAL CENTER AND HOSPITAL, INC.","GENTRI MEDICAL CENTER AND HOSPITAL, INC., CALABARZON, CAVITE",14.2890745,120.9068879
CALABARZON,CAVITE,,"910 Crescini St., Caridad, Cavite",PVT,A. DE LA CRUZ MATERNITY HOSPITAL,11,Dr. Erwin Jay P. Dela Cruz,General,Level 1,(046) 431-3185,None,NaN,None,NaN,NaN,A. DE LA CRUZ MATERNITY HOSPITAL,"A. DE LA CRUZ MATERNITY HOSPITAL, CALABARZON, CAVITE",14.4835071,120.8947569
